{
  "schema_version": "1.0.0",
  "project": {
    "id": "demo-type-heuristic-08",
    "name": "Synthetic Type Heuristic",
    "units": "feet",
    "revit_file": "demo-type-heuristic-08.rvt"
  },
  "coordinate_system": {
    "name": "Project",
    "north_angle": 0.0
  },
  "default_tolerances": {
    "position": 0.083,
    "mounting_height": 0.042,
    "orientation": 10.0
  },
  "levels": [
    {
      "id": "L1",
      "name": "Level 1",
      "elevation": 0.0,
      "floorplan": {
        "image": "plan_L1.png",
        "width_px": 1000,
        "height_px": 800,
        "pixel_to_model": [
          0.01,
          0.0,
          0.0,
          0.0,
          0.01,
          0.0
        ]
      }
    }
  ],
  "devices": [
    {
      "id": "D-HEUR-TYPE",
      "family": "Card Reader",
      "type": "HID-R10",
      "level_id": "L1",
      "elevation_id": "E-NORTH",
      "position": {
        "x": 7.5,
        "y": 1.0,
        "z": 4.0
      },
      "orientation": {
        "facing_angle": 0.0,
        "up_axis": "up"
      }
    },
    {
      "id": "D-EXIT",
      "family": "Exit Sign",
      "type": "EXIT-LED",
      "level_id": "L1",
      "elevation_id": "E-NORTH",
      "position": {
        "x": 8.0,
        "y": 3.0,
        "z": 4.0
      },
      "orientation": {
        "facing_angle": 0.0,
        "up_axis": "up"
      }
    }
  ]
}