{
  "schema_version": "1.0.0",
  "project": {
    "id": "demo-wall-06",
    "name": "Synthetic Device Wall",
    "units": "feet",
    "revit_file": "demo-wall-06.rvt"
  },
  "coordinate_system": {
    "name": "Project",
    "north_angle": 0.0
  },
  "default_tolerances": {
    "position": 0.083,
    "mounting_height": 0.042,
    "orientation": 10.0
  },
  "levels": [
    {
      "id": "L1",
      "name": "Level 1",
      "elevation": 0.0,
      "floorplan": {
        "image": "plan_L1.png",
        "width_px": 1000,
        "height_px": 800,
        "pixel_to_model": [
          0.01,
          0.0,
          0.0,
          0.0,
          0.01,
          0.0
        ]
      }
    }
  ],
  "devices": [
    {
      "id": "D-W00",
      "family": "Card Reader",
      "type": "HID-R10",
      "level_id": "L1",
      "elevation_id": "E-NORTH",
      "position": {
        "x": 8.0,
        "y": -2.75,
        "z": 4.0
      },
      "orientation": {
        "facing_angle": 0.0,
        "up_axis": "up"
      }
    },
    {
      "id": "D-W01",
      "family": "Card Reader",
      "type": "HID-R10",
      "level_id": "L1",
      "elevation_id": "E-NORTH",
      "position": {
        "x": 8.0,
        "y": -2.15,
        "z": 4.0
      },
      "orientation": {
        "facing_angle": 0.0,
        "up_axis": "up"
      }
    },
    {
      "id": "D-W02",
      "family": "Card Reader",
      "type": "HID-R10",
      "level_id": "L1",
      "elevation_id": "E-NORTH",
      "position": {
        "x": 8.0,
        "y": -1.55,
        "z": 4.0
      },
      "orientation": {
        "facing_angle": 0.0,
        "up_axis": "up"
      }
    },
    {
      "id": "D-W03",
      "family": "Card Reader",
      "type": "HID-R10",
      "level_id": "L1",
      "elevation_id": "E-NORTH",
      "position": {
        "x": 8.0,
        "y": -0.9500000000000002,
        "z": 4.0
      },
      "orientation": {
        "facing_angle": 0.0,
        "up_axis": "up"
      }
    },
    {
      "id": "D-W04",
      "family": "Card Reader",
      "type": "HID-R10",
      "level_id": "L1",
      "elevation_id": "E-NORTH",
      "position": {
        "x": 8.0,
        "y": -0.3500000000000001,
        "z": 4.0
      },
      "orientation": {
        "facing_angle": 0.0,
        "up_axis": "up"
      }
    },
    {
      "id": "D-W05",
      "family": "Card Reader",
      "type": "HID-R10",
      "level_id": "L1",
      "elevation_id": "E-NORTH",
      "position": {
        "x": 8.0,
        "y": 0.25,
        "z": 4.0
      },
      "orientation": {
        "facing_angle": 0.0,
        "up_axis": "up"
      }
    },
    {
      "id": "D-W06",
      "family": "Card Reader",
      "type": "HID-R10",
      "level_id": "L1",
      "elevation_id": "E-NORTH",
      "position": {
        "x": 8.0,
        "y": 0.8499999999999996,
        "z": 4.0
      },
      "orientation": {
        "facing_angle": 0.0,
        "up_axis": "up"
      }
    },
    {
      "id": "D-W07",
      "family": "Card Reader",
      "type": "HID-R10",
      "level_id": "L1",
      "elevation_id": "E-NORTH",
      "position": {
        "x": 8.0,
        "y": 1.4500000000000002,
        "z": 4.0
      },
      "orientation": {
        "facing_angle": 0.0,
        "up_axis": "up"
      }
    },
    {
      "id": "D-W08",
      "family": "Card Reader",
      "type": "HID-R10",
      "level_id": "L1",
      "elevation_id": "E-NORTH",
      "position": {
        "x": 8.0,
        "y": 2.05,
        "z": 4.0
      },
      "orientation": {
        "facing_angle": 0.0,
        "up_axis": "up"
      }
    },
    {
      "id": "D-W09",
      "family": "Card Reader",
      "type": "HID-R10",
      "level_id": "L1",
      "elevation_id": "E-NORTH",
      "position": {
        "x": 8.0,
        "y": 2.6499999999999995,
        "z": 4.0
      },
      "orientation": {
        "facing_angle": 0.0,
        "up_axis": "up"
      }
    },
    {
      "id": "D-W10",
      "family": "Card Reader",
      "type": "HID-R10",
      "level_id": "L1",
      "elevation_id": "E-NORTH",
      "position": {
        "x": 8.0,
        "y": 3.25,
        "z": 4.0
      },
      "orientation": {
        "facing_angle": 0.0,
        "up_axis": "up"
      }
    },
    {
      "id": "D-W11",
      "family": "Card Reader",
      "type": "HID-R10",
      "level_id": "L1",
      "elevation_id": "E-NORTH",
      "position": {
        "x": 8.0,
        "y": 3.8499999999999996,
        "z": 4.0
      },
      "orientation": {
        "facing_angle": 0.0,
        "up_axis": "up"
      }
    }
  ]
}