{
  "schema_version": "1.0.0",
  "project": {
    "id": "demo-tolerance-03",
    "name": "Synthetic Tolerance Boundary",
    "units": "feet",
    "revit_file": "demo-tolerance-03.rvt"
  },
  "coordinate_system": {
    "name": "Project",
    "north_angle": 0.0
  },
  "default_tolerances": {
    "position": 0.083,
    "mounting_height": 0.042,
    "orientation": 10.0
  },
  "levels": [
    {
      "id": "L1",
      "name": "Level 1",
      "elevation": 0.0,
      "floorplan": {
        "image": "plan_L1.png",
        "width_px": 1000,
        "height_px": 800,
        "pixel_to_model": [
          0.01,
          0.0,
          0.0,
          0.0,
          0.01,
          0.0
        ]
      }
    }
  ],
  "devices": [
    {
      "id": "D-POS-INSIDE",
      "family": "Card Reader",
      "type": "HID-R10",
      "level_id": "L1",
      "elevation_id": "E-NORTH",
      "position": {
        "x": 8.0,
        "y": 0.0,
        "z": 4.0
      },
      "orientation": {
        "facing_angle": 0.0,
        "up_axis": "up"
      }
    },
    {
      "id": "D-POS-OUTSIDE",
      "family": "Card Reader",
      "type": "HID-R10",
      "level_id": "L1",
      "elevation_id": "E-NORTH",
      "position": {
        "x": 8.0,
        "y": 1.0,
        "z": 4.0
      },
      "orientation": {
        "facing_angle": 0.0,
        "up_axis": "up"
      }
    },
    {
      "id": "D-HEIGHT-INSIDE",
      "family": "Card Reader",
      "type": "HID-R10",
      "level_id": "L1",
      "elevation_id": "E-NORTH",
      "position": {
        "x": 8.0,
        "y": 2.0,
        "z": 4.0
      },
      "orientation": {
        "facing_angle": 0.0,
        "up_axis": "up"
      },
      "mounting_height": 4.0
    },
    {
      "id": "D-HEIGHT-OUTSIDE",
      "family": "Card Reader",
      "type": "HID-R10",
      "level_id": "L1",
      "elevation_id": "E-NORTH",
      "position": {
        "x": 8.0,
        "y": 3.0,
        "z": 4.0
      },
      "orientation": {
        "facing_angle": 0.0,
        "up_axis": "up"
      },
      "mounting_height": 4.0
    },
    {
      "id": "D-ORIENT-INSIDE",
      "family": "Card Reader",
      "type": "HID-R10",
      "level_id": "L1",
      "elevation_id": "E-NORTH",
      "position": {
        "x": 8.0,
        "y": -1.0,
        "z": 4.0
      },
      "orientation": {
        "facing_angle": 0.0,
        "up_axis": "up"
      }
    },
    {
      "id": "D-ORIENT-OUTSIDE",
      "family": "Card Reader",
      "type": "HID-R10",
      "level_id": "L1",
      "elevation_id": "E-NORTH",
      "position": {
        "x": 8.0,
        "y": -2.0,
        "z": 4.0
      },
      "orientation": {
        "facing_angle": 0.0,
        "up_axis": "up"
      }
    },
    {
      "id": "D-OVERRIDE-TIGHT",
      "family": "Card Reader",
      "type": "HID-R10",
      "level_id": "L1",
      "elevation_id": "E-NORTH",
      "position": {
        "x": 8.0,
        "y": -3.0,
        "z": 4.0
      },
      "orientation": {
        "facing_angle": 0.0,
        "up_axis": "up"
      },
      "tolerances": {
        "position": 0.02
      }
    },
    {
      "id": "D-OVERRIDE-LOOSE",
      "family": "Card Reader",
      "type": "HID-R10",
      "level_id": "L1",
      "elevation_id": "E-NORTH",
      "position": {
        "x": 8.0,
        "y": 4.0,
        "z": 4.0
      },
      "orientation": {
        "facing_angle": 0.0,
        "up_axis": "up"
      },
      "tolerances": {
        "position": 0.5
      }
    }
  ]
}