{
  "schema_version": "1.0.0",
  "project": {
    "id": "demo-coverage-04",
    "name": "Synthetic Coverage & Orientation",
    "units": "feet",
    "revit_file": "demo-coverage-04.rvt"
  },
  "coordinate_system": {
    "name": "Project",
    "north_angle": 0.0
  },
  "default_tolerances": {
    "position": 0.083,
    "mounting_height": 0.042,
    "orientation": 10.0
  },
  "levels": [
    {
      "id": "L1",
      "name": "Level 1",
      "elevation": 0.0,
      "floorplan": {
        "image": "plan_L1.png",
        "width_px": 1000,
        "height_px": 800,
        "pixel_to_model": [
          0.01,
          0.0,
          0.0,
          0.0,
          0.01,
          0.0
        ]
      }
    }
  ],
  "devices": [
    {
      "id": "D-INVIEW-ABSENT",
      "family": "Speaker",
      "type": "JBL-C6",
      "level_id": "L1",
      "elevation_id": "E-NORTH",
      "position": {
        "x": 8.0,
        "y": 0.0,
        "z": 4.0
      },
      "orientation": {
        "facing_angle": 0.0,
        "up_axis": "up"
      }
    },
    {
      "id": "D-GAP-ABSENT",
      "family": "Camera",
      "type": "AXIS-P32",
      "level_id": "L1",
      "elevation_id": "E-NORTH",
      "position": {
        "x": -8.0,
        "y": 0.0,
        "z": 7.0
      },
      "orientation": {
        "facing_angle": 180.0,
        "up_axis": "up"
      }
    },
    {
      "id": "D-ORIENT-FLAG",
      "family": "Card Reader",
      "type": "HID-R10",
      "level_id": "L1",
      "elevation_id": "E-NORTH",
      "position": {
        "x": 8.0,
        "y": 2.0,
        "z": 4.0
      },
      "orientation": {
        "facing_angle": 0.0,
        "up_axis": "up"
      }
    },
    {
      "id": "D-DOWN-PASS",
      "family": "Card Reader",
      "type": "HID-R10",
      "level_id": "L1",
      "elevation_id": "E-NORTH",
      "position": {
        "x": 8.0,
        "y": -2.0,
        "z": 4.0
      },
      "orientation": {
        "facing_angle": 0.0,
        "up_axis": "down"
      }
    }
  ]
}